{
  "image_width": 4096,
  "image_height": 2730,
  "nodes": {
    "astralis": { "x": 1701.3, "y": 1026.4 },
    "astralis_carriage_plaza": { "x": 1720.0, "y": 1013.1 },
    "astralis_airport": { "x": 1701.3, "y": 986.4 },
    "granrock": { "x": 1413.3, "y": 901.1 },
    "granrock_north_gate_inn": { "x": 1400.0, "y": 879.8 },
    "port_zephia": { "x": 1920.0, "y": 959.8 },
    "silverport": { "x": 1826.7, "y": 1226.4 },
    "silver_airport": { "x": 1840.0, "y": 1213.0 },
    "wind_rest_isle": { "x": 1626.7, "y": 933.1 },
    "griffin_nest": { "x": 1546.7, "y": 986.4 },
    "eye_of_storm": { "x": 1520.0, "y": 973.1 },
    "stormhold": { "x": 1493.3, "y": 1013.1 },
    "moonlight_grace": { "x": 3133.3, "y": 839.8 },
    "moonport": { "x": 3173.3, "y": 813.1 },
    "moonlight_platform": { "x": 3160.0, "y": 826.5 },
    "moonshadow_floating_island": { "x": 2906.7, "y": 853.1 },
    "lumiera_arch_air_terminal": { "x": 3680.0, "y": 786.5 },
    "emerald_city": { "x": 3080.0, "y": 1119.7 },
    "blood_fort": { "x": 1573.3, "y": 1533.0 },
    "jade_oasis": { "x": 1786.7, "y": 1479.6 },
    "jade_north": { "x": 1746.7, "y": 1439.6 },
    "jade_capital": { "x": 1893.3, "y": 1599.6 },
    "red_sea_desert_supply_station": { "x": 1706.7, "y": 1546.3 },
    "warrior_port": { "x": 1386.7, "y": 1666.3 },
    "jade_port": { "x": 1968.0, "y": 1373.0 },
    "jade_airport": { "x": 1973.3, "y": 1359.7 },
    "marineport": { "x": 466.7, "y": 1039.7 },
    "iron_mountain_port": { "x": 581.3, "y": 919.8 },
    "atlantia_undersea_city": { "x": 341.3, "y": 1119.7 },
    "glacier_city": { "x": 474.7, "y": 1354.3 },
    "atlantis_floating_base": { "x": 493.3, "y": 999.8 },
    "time_port": { "x": 1648.0, "y": 453.2 },
    "time_airport": { "x": 1653.3, "y": 439.9 },
    "labyrinth_of_time": { "x": 1701.3, "y": 485.2 },
    "ethernia_core": { "x": 1640.0, "y": 386.6 },
    "spirit_gate": { "x": 1573.3, "y": 466.6 },
    "sealed_lands": { "x": 1733.3, "y": 506.5 }
  },
  "continents": {
    "elysion": { "x": 1706.7, "y": 1093.1 },
    "lumiera": { "x": 3333.3, "y": 986.4 },
    "chaos_ria": { "x": 1733.3, "y": 1652.9 },
    "atlantis": { "x": 480.0, "y": 1066.4 },
    "grimoire": { "x": 1600.0, "y": 439.9 }
  },
  "hazards": {
    "red_sea_desert_sandstorm_zone": { "x": 1706.7, "y": 1599.6 },
    "red_sand_coast_pirate_zone": { "x": 1413.3, "y": 1679.6 },
    "northern_ocean_ice_sea": { "x": 933.3, "y": 533.2 },
    "grimoire_time_distortion_zone": { "x": 1706.7, "y": 479.9 },
    "sealed_lands_forbidden_zone": { "x": 1733.3, "y": 506.5 },
    "phantom_road_danger_zone": { "x": 1306.7, "y": 946.4 },
    "atlantis_ice_road_closure_zone": { "x": 560.0, "y": 1253.0 },
    "stormhold_air_turbulence_zone": { "x": 1506.7, "y": 999.8 }
  },
  "hazard_radius_scale": 0.4096
}
